{
  "$schema": "https://json-schema.org/draft/2020-12/schema",
  "$id": "https://ph7x.com/schemas/m365-governance/evidence/3.0.0",
  "title": "Evidence document",
  "description": "What a collector is allowed to hand to the engine. Structure only. See docs/EVIDENCE-SCHEMA.md.",
  "type": "object",
  "additionalProperties": false,
  "required": [
    "$schema",
    "provenance",
    "coverage",
    "resource",
    "facts"
  ],
  "properties": {
    "provenance": {
      "$ref": "#/$defs/provenance"
    },
    "coverage": {
      "$ref": "#/$defs/coverage"
    },
    "resource": {
      "$ref": "#/$defs/resource"
    },
    "facts": {
      "$ref": "#/$defs/factsMap"
    },
    "$schema": {
      "type": "string",
      "const": "https://ph7x.com/schemas/m365-governance/evidence/3.0.0",
      "description": "The exact contract this document claims, which must be the $id of the schema validating it. An instance convention and not the dialect keyword: inside a schema document `$schema` names the JSON Schema dialect, and using one field for both meanings is what this separation exists to prevent. It replaces `schema_version`, which was a second version that could not even express the one in the $id — `1.0` against a contract ending in `/1.2.0` — and was maintained by hand."
    }
  },
  "$defs": {
    "provenance": {
      "type": "object",
      "additionalProperties": false,
      "required": [
        "collected_at",
        "collector",
        "collector_version",
        "source_system",
        "identity_kind",
        "acquisition",
        "tenant"
      ],
      "properties": {
        "collected_at": {
          "type": "string",
          "format": "date-time"
        },
        "collector": {
          "type": "string",
          "minLength": 3
        },
        "collector_version": {
          "type": "string",
          "pattern": "^[0-9]+\\.[0-9]+\\.[0-9]+$"
        },
        "source_system": {
          "type": "string",
          "minLength": 3
        },
        "source_api": {
          "type": "string",
          "minLength": 3
        },
        "identity_kind": {
          "enum": [
            "application",
            "delegated",
            "not-established"
          ],
          "description": "Which authentication identity observed this. A delegated run sees what one person sees, and the difference changes what an empty result means. `not-established` is for evidence that does not carry the identity that produced it, which is common in an import: an export that does not name its collecting identity leaves this unknown, and unknown is what it must say. It used to also accept `imported`, which answered a different question — how the evidence got here, not who observed it — and hid the fact that an import's identity is usually simply not recorded."
        },
        "scopes": {
          "type": "array",
          "items": {
            "type": "string"
          }
        },
        "import_source": {
          "$ref": "#/$defs/importSource"
        },
        "acquisition": {
          "enum": [
            "collected",
            "imported"
          ],
          "description": "How this evidence reached the engine. `collected` means a collector in this system read it; `imported` means it came from a tool we did not write, whose collection completeness cannot be verified here. Separate from identity because they answer different questions and an import can perfectly well preserve the identity that collected it."
        },
        "tenant": {
          "$ref": "#/$defs/tenant"
        },
        "identity_method": {
          "type": "string",
          "enum": [
            "interactive",
            "device-code",
            "certificate",
            "not-established"
          ],
          "description": "HOW the identity authenticated, which is a different question from what kind of identity it is. `identity_kind` decides what an empty result means; this is operational provenance, so an administrator can tell an unattended run from somebody's session. Never the certificate, the key or the token."
        },
        "client_id": {
          "type": [
            "string",
            "null"
          ],
          "description": "The application registration the run authenticated as. A client id names something an administrator can look up; everything else about the credential stays out of the evidence."
        }
      },
      "allOf": [
        {
          "$comment": "A collected run knows which API it used and with what permissions. Keyed on acquisition and not on identity: the two were one field, so the rule that governs scopes was riding on the answer to a different question.",
          "if": {
            "properties": {
              "acquisition": {
                "const": "collected"
              }
            },
            "required": [
              "acquisition"
            ]
          },
          "then": {
            "required": [
              "source_api",
              "scopes"
            ],
            "not": {
              "required": [
                "import_source"
              ]
            }
          }
        },
        {
          "$comment": "An import has no scopes of ours, and writing `scopes: []` would read as 'no permissions were needed' rather than 'this does not apply'. It carries who exported it instead.",
          "if": {
            "properties": {
              "acquisition": {
                "const": "imported"
              }
            },
            "required": [
              "acquisition"
            ]
          },
          "then": {
            "required": [
              "import_source"
            ],
            "not": {
              "required": [
                "scopes"
              ]
            }
          }
        }
      ]
    },
    "coverage": {
      "type": "object",
      "additionalProperties": false,
      "required": [
        "requested",
        "completed",
        "unavailable"
      ],
      "properties": {
        "requested": {
          "type": "array",
          "items": {
            "type": "string"
          }
        },
        "completed": {
          "type": "array",
          "items": {
            "type": "string"
          }
        },
        "unavailable": {
          "type": "object",
          "additionalProperties": {
            "type": "object",
            "additionalProperties": false,
            "required": [
              "state",
              "detail"
            ],
            "properties": {
              "state": {
                "$ref": "#/$defs/absentState"
              },
              "detail": {
                "type": "string",
                "minLength": 5
              }
            }
          }
        }
      }
    },
    "resource": {
      "type": "object",
      "additionalProperties": false,
      "required": [
        "workload",
        "type",
        "native_id",
        "tenant",
        "scope",
        "parent"
      ],
      "properties": {
        "workload": {
          "type": "string",
          "minLength": 2,
          "description": "The namespace that owns the identifier. Without it two workloads can name the same string and mean different things: a Team and a site can share a URL, and an Exchange mailbox and a OneDrive can share an address."
        },
        "type": {
          "type": "string",
          "minLength": 2
        },
        "native_id": {
          "type": "string",
          "minLength": 1,
          "description": "The identifier the platform itself uses, carried whole and never taken apart. A URL, a GUID, a path, something containing colons — all lossless, because nothing here reads inside it."
        },
        "tenant": {
          "$ref": "#/$defs/tenant",
          "description": "The tenant this resource belongs to, so identity is self-contained rather than inferred from the document it arrived in. Canonical when the directory identity is observable; the host is an endpoint until then."
        },
        "scope": {
          "type": "string",
          "enum": [
            "tenant",
            "collection",
            "container",
            "item"
          ],
          "description": "How far this resource's own settings reach. Deliberately about governance reach rather than a product's menu structure, so it holds across workloads: a SharePoint site, an Exchange mailbox and a Team are all `collection`; a list, a folder and a channel are all `container`. A model naming SharePoint's levels would need a second model at the second workload."
        },
        "parent": {
          "oneOf": [
            {
              "$ref": "#/$defs/resource_ref"
            },
            {
              "type": "null"
            }
          ],
          "description": "The resource that contains this one, as a reference that resolves inside the assessment. Null ONLY for a tenant, which is the single root. Required-and-nullable rather than optional: an omitted containment field is one that gets forgotten, and the relationship goes back into prose. Containment only — a relationship that is not containment stays a graph relationship and is not forced in here."
        },
        "display_name": {
          "type": "string"
        },
        "url": {
          "type": "string"
        }
      },
      "description": "What was read, and which thing it was. Identity is STRUCTURED: an explicit workload, an explicit type, an opaque native identifier and the tenant. It used to be one string with a comma convention nobody validated (`contoso,site,archived`), which meant containment lived in a substring and a URL."
    },
    "collectionState": {
      "enum": [
        "observed",
        "missing",
        "not-supported",
        "permission-denied",
        "partial",
        "invalid"
      ]
    },
    "absentState": {
      "enum": [
        "missing",
        "not-supported",
        "permission-denied",
        "partial"
      ]
    },
    "factsMap": {
      "type": "object",
      "minProperties": 1,
      "additionalProperties": {
        "$ref": "#/$defs/factsNode"
      }
    },
    "factsNode": {
      "anyOf": [
        {
          "$ref": "#/$defs/scalarFact"
        },
        {
          "$ref": "#/$defs/aggregateFact"
        },
        {
          "$ref": "#/$defs/factsMap"
        }
      ]
    },
    "scalarFact": {
      "type": "object",
      "additionalProperties": false,
      "required": [
        "state"
      ],
      "properties": {
        "state": {
          "$ref": "#/$defs/collectionState"
        },
        "value": {},
        "detail": {
          "type": "string"
        },
        "raw": {
          "$ref": "#/$defs/raw"
        }
      },
      "allOf": [
        {
          "$comment": "An observed fact has a value. Absence has a reason, never a bare null.",
          "if": {
            "properties": {
              "state": {
                "const": "observed"
              }
            },
            "required": [
              "state"
            ]
          },
          "then": {
            "required": [
              "value"
            ]
          }
        },
        {
          "$comment": "Anything not observed says why.",
          "if": {
            "properties": {
              "state": {
                "enum": [
                  "missing",
                  "not-supported",
                  "permission-denied",
                  "invalid"
                ]
              }
            },
            "required": [
              "state"
            ]
          },
          "then": {
            "required": [
              "detail"
            ]
          }
        }
      ]
    },
    "raw": {
      "type": "object",
      "additionalProperties": false,
      "required": [
        "field",
        "value"
      ],
      "properties": {
        "field": {
          "type": "string",
          "minLength": 1
        },
        "value": {}
      }
    },
    "aggregateFact": {
      "$comment": "A counted collection whose members may be groups. See docs/EVIDENCE-SCHEMA.md section 8.",
      "type": "object",
      "additionalProperties": false,
      "required": [
        "state",
        "expansion_complete"
      ],
      "properties": {
        "state": {
          "$ref": "#/$defs/collectionState"
        },
        "detail": {
          "type": "string"
        },
        "direct": {
          "type": "array",
          "items": {
            "$ref": "#/$defs/principal"
          }
        },
        "groups": {
          "type": "array",
          "items": {
            "$ref": "#/$defs/groupPrincipal"
          }
        },
        "expansion_complete": {
          "type": "boolean"
        },
        "effective_count": {
          "type": "integer",
          "minimum": 0
        },
        "minimum_count": {
          "type": "integer",
          "minimum": 0
        },
        "direct_count": {
          "$ref": "#/$defs/scalarFact",
          "$comment": "How many members are individual principals. Separate from the total because it answers a different question: the total asks how many there are, this asks whether any of them is a person."
        },
        "group_count": {
          "$ref": "#/$defs/scalarFact"
        }
      },
      "allOf": [
        {
          "$comment": "Complete expansion produces an exact count and no lower bound.",
          "if": {
            "properties": {
              "expansion_complete": {
                "const": true
              }
            },
            "required": [
              "expansion_complete"
            ]
          },
          "then": {
            "required": [
              "effective_count"
            ],
            "not": {
              "required": [
                "minimum_count"
              ]
            }
          }
        },
        {
          "$comment": "Incomplete expansion produces a lower bound and never an exact count.",
          "if": {
            "properties": {
              "expansion_complete": {
                "const": false
              }
            },
            "required": [
              "expansion_complete"
            ]
          },
          "then": {
            "required": [
              "minimum_count"
            ],
            "not": {
              "required": [
                "effective_count"
              ]
            }
          }
        }
      ]
    },
    "principal": {
      "type": "object",
      "additionalProperties": false,
      "required": [
        "principal_id",
        "principal_type"
      ],
      "properties": {
        "principal_id": {
          "type": "string",
          "minLength": 1
        },
        "principal_type": {
          "enum": [
            "user",
            "group",
            "service-principal"
          ]
        }
      }
    },
    "groupPrincipal": {
      "type": "object",
      "additionalProperties": false,
      "required": [
        "principal_id",
        "principal_type",
        "expansion"
      ],
      "properties": {
        "principal_id": {
          "type": "string",
          "minLength": 1
        },
        "principal_type": {
          "const": "group"
        },
        "expansion": {
          "type": "object",
          "additionalProperties": false,
          "required": [
            "status"
          ],
          "properties": {
            "status": {
              "enum": [
                "complete",
                "incomplete",
                "not-attempted"
              ]
            },
            "member_count": {
              "type": "integer",
              "minimum": 0
            },
            "detail": {
              "type": "string"
            }
          }
        }
      }
    },
    "importSource": {
      "$comment": "Named so that a reader can go back to the person who ran the export. Every field here is something the engine cannot check and a person can.",
      "type": "object",
      "additionalProperties": false,
      "required": [
        "tool",
        "exported_at"
      ],
      "properties": {
        "tool": {
          "type": "string",
          "minLength": 2
        },
        "version": {
          "type": "string",
          "minLength": 1
        },
        "exported_at": {
          "type": "string",
          "format": "date-time"
        },
        "exported_by": {
          "type": "string",
          "minLength": 1
        },
        "detail": {
          "type": "string"
        }
      }
    },
    "tenant": {
      "type": "object",
      "additionalProperties": false,
      "required": [
        "id",
        "host"
      ],
      "description": "Which tenant this is about. Two fields because a tenant has one canonical identity and any number of endpoints: the admin centre, the primary host and every multi-geo satellite are all addresses of the same organisation, and treating an address as the identity is what made one tenant read as two.",
      "properties": {
        "id": {
          "type": [
            "string",
            "null"
          ],
          "description": "The directory identity, canonical when it can be observed. Required and nullable rather than optional: null says nobody read it, and an omitted field says nothing at all. No collection path for it has been proven on a tenant yet, so today it is null and the host carries the identity."
        },
        "host": {
          "type": "string",
          "minLength": 1,
          "description": "The SharePoint host, which is an endpoint rather than an identity. Normalised from the admin centre form documented by Microsoft as `{prefix}-admin`, so one tenant reached two ways produces one value. That normalisation is a compatibility mechanism for as long as the directory id is unobserved, not the definition of a tenant: a multi-geo satellite still carries its own host and is not silently folded into the primary."
        }
      }
    },
    "resource_ref": {
      "type": "object",
      "additionalProperties": false,
      "description": "A reference to one resource, by the three things that identify it. STRUCTURED, never a parsed string. The audit proposed `<service>:<type>:<native-id>` and it does not survive contact with real identifiers: a site's native id IS its URL, so splitting on a colon yields `https` as the first field. Escaping would be a grammar nobody validates, and every consumer would re-implement the parser — the second authority this contract exists to remove. Comparison here is structural equality, and a native id is a value rather than syntax.",
      "required": [
        "workload",
        "type",
        "native_id"
      ],
      "properties": {
        "workload": {
          "type": "string",
          "minLength": 2,
          "description": "The namespace that owns the identifier. Without it two workloads can name the same string and mean different things: a Team and a site can share a URL, and an Exchange mailbox and a OneDrive can share an address."
        },
        "type": {
          "type": "string",
          "minLength": 2,
          "description": "The resource type within that workload."
        },
        "native_id": {
          "type": "string",
          "minLength": 1,
          "description": "The identifier the platform itself uses, carried whole and never taken apart. A URL, a GUID, a path, something containing colons — all lossless, because nothing here reads inside it."
        }
      }
    }
  }
}
