{
  "$schema": "https://ph7x.com/schemas/m365-governance/evidence/3.0.0",
  "provenance": {
    "collected_at": "2026-08-06T16:00:00Z",
    "collector": "spo-collector",
    "collector_version": "0.3.0",
    "source_system": "SharePoint Online",
    "source_api": "PnP.PowerShell / CSOM",
    "tenant": {
      "id": null,
      "host": "contoso.sharepoint.com"
    },
    "identity_kind": "delegated",
    "acquisition": "collected",
    "scopes": [
      "AllSites.Read"
    ]
  },
  "coverage": {
    "requested": [
      "spfx"
    ],
    "completed": [
      "spfx"
    ],
    "unavailable": {}
  },
  "resource": {
    "workload": "sharepoint",
    "type": "site",
    "native_id": "contoso,site,spfx-none",
    "tenant": {
      "id": null,
      "host": "contoso.sharepoint.com"
    },
    "scope": "collection",
    "parent": {
      "workload": "sharepoint",
      "type": "tenant",
      "native_id": "contoso.sharepoint.com"
    },
    "display_name": "Comms",
    "url": "https://contoso.sharepoint.com/sites/spfx-none"
  },
  "facts": {
    "spfx": {
      "solutions": {
        "state": "missing",
        "detail": "The site has no app catalog."
      },
      "solution_count": {
        "state": "missing",
        "detail": "The catalog was not read."
      },
      "upgradable_count": {
        "state": "missing",
        "detail": "The catalog was not read."
      }
    }
  }
}
