{
  "$schema": "https://ph7x.com/schemas/m365-governance/evidence/3.0.0",
  "provenance": {
    "collected_at": "2026-08-06T09:00:00Z",
    "collector": "spo-collector",
    "collector_version": "0.3.0",
    "source_system": "SharePoint Online",
    "source_api": "PnP.PowerShell / SharePoint Admin",
    "tenant": {
      "id": null,
      "host": "contoso.sharepoint.com"
    },
    "identity_kind": "application",
    "acquisition": "collected",
    "scopes": [
      "Sites.Read.All"
    ]
  },
  "coverage": {
    "requested": [
      "sharing"
    ],
    "completed": [
      "sharing"
    ],
    "unavailable": {}
  },
  "resource": {
    "workload": "sharepoint",
    "type": "site",
    "native_id": "contoso,site,drafting",
    "tenant": {
      "id": null,
      "host": "contoso.sharepoint.com"
    },
    "scope": "collection",
    "parent": {
      "workload": "sharepoint",
      "type": "tenant",
      "native_id": "contoso.sharepoint.com"
    },
    "display_name": "Drafting",
    "url": "https://contoso.sharepoint.com/sites/drafting"
  },
  "facts": {
    "sharing": {
      "capability": {
        "state": "observed",
        "value": "ExternalUserAndGuestSharing",
        "raw": {
          "field": "SharingCapability",
          "value": "ExternalUserAndGuestSharing"
        }
      },
      "default_link_type": {
        "state": "observed",
        "value": "Direct",
        "raw": {
          "field": "DefaultSharingLinkType",
          "value": "Direct"
        }
      },
      "effective_default_link_type": {
        "state": "observed",
        "value": "Direct",
        "raw": {
          "field": "DefaultSharingLinkType",
          "value": "Direct"
        }
      },
      "default_link_permission": {
        "state": "observed",
        "value": "Edit",
        "raw": {
          "field": "DefaultLinkPermission",
          "value": "Edit"
        }
      }
    }
  }
}