{
  "$schema": "https://ph7x.com/schemas/m365-governance/evidence/3.0.0",
  "provenance": {
    "collected_at": "2026-08-05T14:02:11Z",
    "collector": "spo-collector",
    "collector_version": "0.1.0",
    "source_system": "SharePoint Online",
    "source_api": "PnP.PowerShell / CSOM",
    "tenant": {
      "id": null,
      "host": "contoso.sharepoint.com"
    },
    "identity_kind": "application",
    "acquisition": "collected",
    "scopes": [
      "Sites.Read.All"
    ]
  },
  "coverage": {
    "requested": [
      "items",
      "permissions"
    ],
    "completed": [
      "items",
      "permissions"
    ],
    "unavailable": {}
  },
  "resource": {
    "workload": "sharepoint",
    "type": "list",
    "native_id": "contoso,list,catalog-over-limit",
    "tenant": {
      "id": null,
      "host": "contoso.sharepoint.com"
    },
    "scope": "container",
    "parent": {
      "workload": "sharepoint",
      "type": "site",
      "native_id": "contoso,site,documents-host"
    },
    "display_name": "App Packages",
    "url": "https://contoso.sharepoint.com/sites/Finance/Shared%20Documents"
  },
  "facts": {
    "items": {
      "count": {
        "state": "observed",
        "value": 4200,
        "raw": {
          "field": "ItemCount",
          "value": 4200
        }
      }
    },
    "permissions": {
      "inheritance_broken": {
        "state": "observed",
        "value": false,
        "raw": {
          "field": "hasUniqueRoleAssignments",
          "value": false
        }
      },
      "unique_scope_count": {
        "state": "observed",
        "value": 61400,
        "raw": {
          "field": "HasUniqueRoleAssignments",
          "value": 61400
        }
      }
    },
    "list": {
      "is_catalog": {
        "state": "observed",
        "value": true,
        "raw": {
          "field": "IsCatalog",
          "value": true
        }
      },
      "is_system": {
        "state": "observed",
        "value": false,
        "raw": {
          "field": "IsSystemList",
          "value": false
        }
      },
      "is_application": {
        "state": "observed",
        "value": false,
        "raw": {
          "field": "IsApplicationList",
          "value": false
        }
      },
      "hidden": {
        "state": "observed",
        "value": false,
        "raw": {
          "field": "Hidden",
          "value": false
        }
      },
      "base_template": {
        "state": "observed",
        "value": 125,
        "raw": {
          "field": "BaseTemplate",
          "value": 125
        }
      }
    }
  }
}
