{
  "$schema": "https://ph7x.com/schemas/m365-governance/evidence/3.0.0",
  "provenance": {
    "collected_at": "2026-08-05T14:02:11Z",
    "collector": "spo-collector",
    "collector_version": "0.1.0",
    "source_system": "SharePoint Online",
    "source_api": "Microsoft Graph v1.0",
    "tenant": {
      "id": null,
      "host": "contoso.sharepoint.com"
    },
    "identity_kind": "delegated",
    "acquisition": "collected",
    "scopes": [
      "Sites.Read.All"
    ]
  },
  "coverage": {
    "requested": [
      "owners"
    ],
    "completed": [
      "owners"
    ],
    "unavailable": {}
  },
  "resource": {
    "workload": "sharepoint",
    "type": "site",
    "native_id": "contoso,site,sales",
    "tenant": {
      "id": null,
      "host": "contoso.sharepoint.com"
    },
    "scope": "collection",
    "parent": {
      "workload": "sharepoint",
      "type": "tenant",
      "native_id": "contoso.sharepoint.com"
    },
    "display_name": "Sales",
    "url": "https://contoso.sharepoint.com/sites/Sales"
  },
  "facts": {
    "owners": {
      "state": "observed",
      "direct": [
        {
          "principal_id": "user-1",
          "principal_type": "user"
        },
        {
          "principal_id": "user-2",
          "principal_type": "user"
        }
      ],
      "groups": [],
      "expansion_complete": true,
      "effective_count": 2
    }
  }
}
